{
  "$schema": "../block.schema.json",
  "name": "level-ldtk",
  "description": "Load LDtk-exported levels (tiles + entities) into the spawn pipeline",
  "dependencies": [
    "level-loading",
    "rendering"
  ],
  "nugetDependencies": [
    {
      "id": "LDtkMonogame",
      "version": "1.8.0"
    },
    {
      "id": "LDtkMonogame.ContentPipeline",
      "version": "1.8.0"
    }
  ],
  "csprojProperties": {},
  "mgcbEntries": [
    "/importer:LDtkImporter",
    "/processor:LDtkProcessor"
  ],
  "postInstallNotes": "## level-ldtk installed\n\nExport your LDtk project to a `.ldtk` file under `Content/`, then add it to your `.mgcb`:\n```\n#begin Levels/your_project.ldtk\n/importer:LDtkImporter\n/processor:LDtkProcessor\n/build:Levels/your_project.ldtk\n```\n\nReference the LDtkMonogame content pipeline DLL in your csproj's `MonoGameMGCBAdditionalArguments`:\n```\n<MonoGameMGCBAdditionalArguments>$(MonoGameMGCBAdditionalArguments) /reference:$(NuGetPackageRoot)ldtkmonogame.contentpipeline/1.8.0/lib/net8.0/LDtk.ContentPipeline.dll</MonoGameMGCBAdditionalArguments>\n```\n\nAt runtime, add both parsers to your pipeline AFTER `LevelLoadRequestSystem`:\n```csharp\nnew LDtkTileParserSystem(world, content, ...)\nnew LDtkEntityParserSystem(world, ...)\n```\n\n**Premises:** `docs/premises.md`",
  "premisesRef": "docs/premises.md"
}
