{
  "$schema": "../block.schema.json",
  "name": "rendering",
  "description": "Sprite-first draw stack: DrawComponent, render targets, culling, Y-sort, MasterRenderSystem",
  "dependencies": [
    "foundation"
  ],
  "nugetDependencies": [],
  "csprojProperties": {},
  "mgcbEntries": [],
  "postInstallNotes": "## rendering installed\n\nThe draw stack runs in this order each frame:\n\n1. **Prep systems** (per draw type) populate `DrawComponent` from source data \u2014 e.g. `SpritePrepSystem` reads `SpriteInfoComponent`.\n2. **CullingSystem** adds/removes `VisibleComponent` based on camera view bounds.\n3. **YSortSystem** writes a depth offset so back-to-front sprites overlap correctly.\n4. **MasterRenderSystem** iterates render targets (Main \u2192 UI \u2192 HUD) and submits draw calls.\n5. **FinalDrawSystem** composites the targets onto the screen.\n\nEntities that render need: `TransformComponent`, the type-specific source (e.g. `SpriteInfoComponent`), `DrawComponent`, and `VisibleComponent`. `VisibleComponent` is a tag \u2014 `CullingSystem` adds/removes it.\n\n**Premises:** `docs/premises.md`",
  "premisesRef": "docs/premises.md"
}
