{
  "$schema": "../block.schema.json",
  "name": "camera",
  "description": "Camera-follow behavior (auto-track a target entity); the Camera class itself ships in rendering",
  "dependencies": [
    "rendering"
  ],
  "nugetDependencies": [],
  "csprojProperties": {},
  "mgcbEntries": [],
  "postInstallNotes": "## camera installed\n\nThe `Camera` class itself ships in the `rendering` block (it's a hard dependency of the draw stack \u2014 `MasterRenderSystem` reads its position and zoom each frame). This block adds the optional follow behavior:\n\n1. Add `CameraFollowTargetComponent` to the entity you want to follow (typically the player).\n2. Add `CameraFollowSystem(world, camera)` to your update pipeline. It runs AFTER any system that moves the followed entity and BEFORE rendering.\n\nFor manual camera control (cutscenes, fixed-camera screens) just write to the `Camera` directly \u2014 don't install this block.\n\n**Premises:** `docs/rendering/premises.md` (camera-pipeline section)",
  "premisesRef": "docs/rendering/premises.md"
}
